{
  "$schema": "../../../story.schema.json",
  "id": "hp-book-the-forest",
  "title": "The Forest",
  "subtitle": "Hp Book",
  "start": "scene_1",
  "actors": {
    "malfoy": {
      "name": "Malfoy",
      "kind": "human",
      "height": 1.45,
      "robe": "#18181f",
      "trim": "#1a472a",
      "skin": "#f0d8c8",
      "hair": "#e8dca0",
      "hairStyle": "short",
      "eyes": "#8a9aa8",
      "glasses": "none",
      "beard": "none",
      "outfit": "student",
      "hat": "none",
      "scar": false,
      "voice": 1.05,
      "subtitleColor": "#b8d8b8"
    },
    "hound": {
      "name": "Hound",
      "kind": "dog3",
      "height": 3.4,
      "robe": "#3e2c1f",
      "skin": "#e8c4a0",
      "hair": "#3a2a1a",
      "hairStyle": "short",
      "eyes": "#3a5a2a",
      "glasses": "none",
      "beard": "none",
      "outfit": "student",
      "hat": "none",
      "scar": false,
      "voice": 1,
      "subtitleColor": "#ffffff"
    },
    "harry": {
      "name": "Harry",
      "kind": "human",
      "height": 1.45,
      "robe": "#18181f",
      "trim": "#7f0909",
      "skin": "#e3b08c",
      "hair": "#120d08",
      "hairStyle": "messy",
      "eyes": "#2e7d32",
      "glasses": "round",
      "beard": "none",
      "outfit": "student",
      "hat": "none",
      "scar": true,
      "voice": 1.15,
      "subtitleColor": "#f3d27a"
    }
  },
  "scenes": {
    "scene_1_wrong": {
      "location": "forbidden_forest",
      "cast": {
        "malfoy": "auto_2",
        "hound": "auto_threat",
        "harry": "auto_1"
      },
      "beats": [
        {
          "camera": "medium",
          "on": "harry",
          "ms": 500
        },
        {
          "narrate": "Harry hesitates — and chooses to hold back."
        },
        {
          "move": "harry",
          "to": "auto_entry",
          "async": true
        },
        {
          "camera": "low",
          "on": "hound",
          "ms": 600
        },
        {
          "sfx": "roar"
        },
        {
          "anim": "hound",
          "clip": "roar"
        },
        {
          "together": [
            {
              "anim": "hound",
              "clip": "lunge"
            },
            {
              "fx": "shake",
              "ms": 700
            }
          ]
        },
        {
          "together": [
            {
              "anim": "harry",
              "clip": "fall",
              "hold": true
            },
            {
              "sfx": "thud"
            }
          ]
        },
        {
          "fx": "red_out",
          "ms": 1500
        }
      ],
      "ending": {
        "kind": "death",
        "title": "Wrong Turn",
        "text": "In the book, Harry chose to step towards the clearing. Choosing to hold back ended the story here."
      }
    },
    "scene_1": {
      "location": "forbidden_forest",
      "cast": {
        "harry": "auto_1",
        "malfoy": "auto_2"
      },
      "beats": [
        {
          "camera": "wide",
          "ms": 0
        },
        {
          "music": "mystery"
        },
        {
          "narrate": "Tall trees closed over the path, and the moon barely reached the ground."
        },
        {
          "camera": "medium",
          "on": "malfoy",
          "ms": 700
        },
        {
          "narrate": "Malfoy screamed and ran back down the path."
        },
        {
          "spawn": "hound",
          "at": "auto_threat"
        },
        {
          "sfx": "growl"
        },
        {
          "camera": "medium",
          "on": "hound",
          "ms": 700
        },
        {
          "move": "hound",
          "to": "auto_entry",
          "run": true,
          "async": true
        },
        {
          "narrate": "The hound bolted after him."
        },
        {
          "narrate": "Harry did not run."
        },
        {
          "camera": "close",
          "on": "harry",
          "ms": 600
        }
      ],
      "title": "The Forbidden Forest",
      "choice": {
        "prompt": "What should Harry do?",
        "seconds": 10,
        "options": [
          {
            "label": "Hold back",
            "correct": false,
            "goto": "scene_1_wrong"
          },
          {
            "label": "Step towards the clearing",
            "correct": true,
            "goto": "scene_2"
          }
        ]
      }
    },
    "scene_2": {
      "location": "forbidden_forest",
      "cast": {
        "harry": "auto_1",
        "malfoy": "auto_2",
        "hound": "auto_threat"
      },
      "beats": [
        {
          "camera": "medium",
          "on": "harry",
          "ms": 700
        },
        {
          "anim": "harry",
          "clip": "cast",
          "async": true
        },
        {
          "narrate": "He raised his wand and stepped towards the clearing."
        },
        {
          "narrate": "The hooded figure lifted its head and glided towards Harry."
        },
        {
          "camera": "medium",
          "on": "harry",
          "ms": 700
        },
        {
          "anim": "harry",
          "clip": "fall",
          "async": true,
          "hold": true
        },
        {
          "narrate": "Harry fell to his knees, clutching his forehead."
        },
        {
          "sfx": "thud"
        },
        {
          "narrate": "Hoofbeats thundered through the trees, and the hooded figure fled into the dark."
        }
      ],
      "ending": {
        "kind": "victory",
        "title": "The Forest",
        "text": "You followed Harry through “The Forest” the way the book tells it."
      }
    }
  }
}
