{
  "$schema": "../../../story.schema.json",
  "id": "hp-book-the-letters",
  "title": "The Letters",
  "subtitle": "Hp Book",
  "start": "scene_1",
  "actors": {
    "vernon": {
      "name": "Uncle Vernon",
      "kind": "human",
      "height": 1.75,
      "robe": "#3a3a4a",
      "skin": "#e8b498",
      "hair": "#3a2a1a",
      "hairStyle": "short",
      "eyes": "#3a5a2a",
      "glasses": "none",
      "beard": "short",
      "outfit": "adult",
      "hat": "none",
      "scar": false,
      "voice": 0.8,
      "subtitleColor": "#d8a888"
    },
    "harry": {
      "name": "Harry",
      "kind": "human",
      "height": 1.45,
      "robe": "#18181f",
      "trim": "#7f0909",
      "skin": "#e3b08c",
      "hair": "#120d08",
      "hairStyle": "messy",
      "eyes": "#2e7d32",
      "glasses": "round",
      "beard": "none",
      "outfit": "student",
      "hat": "none",
      "scar": true,
      "voice": 1.15,
      "subtitleColor": "#f3d27a"
    },
    "dudley": {
      "name": "Dudley",
      "kind": "human",
      "height": 1.5,
      "robe": "#5a6a8a",
      "skin": "#f2c8b0",
      "hair": "#d0b070",
      "hairStyle": "short",
      "eyes": "#3a5a2a",
      "glasses": "none",
      "beard": "none",
      "outfit": "adult",
      "hat": "none",
      "scar": false,
      "voice": 1,
      "subtitleColor": "#d8c8a8"
    },
    "petunia": {
      "name": "Aunt Petunia",
      "kind": "human",
      "height": 1.7,
      "robe": "#8a8a6a",
      "skin": "#efd4c0",
      "hair": "#c8b070",
      "hairStyle": "bun",
      "eyes": "#3a5a2a",
      "glasses": "none",
      "beard": "none",
      "outfit": "adult",
      "hat": "none",
      "scar": false,
      "voice": 1.3,
      "subtitleColor": "#e8e0a8"
    }
  },
  "scenes": {
    "scene_1_wrong": {
      "location": "privet_drive",
      "cast": {
        "harry": "auto_1",
        "vernon": "auto_2",
        "dudley": "auto_3",
        "petunia": "auto_4"
      },
      "beats": [
        {
          "camera": "medium",
          "on": "harry",
          "ms": 500
        },
        {
          "narrate": "Harry hesitates — and chooses to leave the letter."
        },
        {
          "anim": "harry",
          "clip": "shake"
        },
        {
          "narrate": "The moment slips away, and it cannot be taken back."
        },
        {
          "fx": "fade_out",
          "ms": 1500
        }
      ],
      "ending": {
        "kind": "failure",
        "title": "A Different Ending",
        "text": "In the book, Harry chose to grab the letter. Choosing to leave the letter ended the story here."
      }
    },
    "scene_1": {
      "location": "privet_drive",
      "cast": {
        "vernon": "auto_2",
        "dudley": "auto_3",
        "petunia": "auto_4"
      },
      "beats": [
        {
          "camera": "wide",
          "ms": 0
        },
        {
          "music": "mystery"
        },
        {
          "narrate": "Uncle Vernon sat at the table behind his newspaper while Aunt Petunia fussed over Dudley."
        },
        {
          "spawn": "harry",
          "at": "auto_entry"
        },
        {
          "move": "harry",
          "to": "auto_1",
          "async": true
        },
        {
          "camera": "medium",
          "on": "harry",
          "ms": 700
        },
        {
          "anim": "harry",
          "clip": "reach",
          "async": true
        },
        {
          "narrate": "Harry walked to the front door and picked up the letters."
        },
        {
          "camera": "medium",
          "on": "dudley",
          "ms": 700
        },
        {
          "anim": "dudley",
          "clip": "point",
          "async": true
        },
        {
          "narrate": "Dudley laughed and pointed at Harry."
        },
        {
          "camera": "close",
          "on": "harry",
          "ms": 600
        }
      ],
      "title": "Number Four, Privet Drive",
      "choice": {
        "prompt": "What should Harry do?",
        "seconds": 10,
        "options": [
          {
            "label": "Leave the letter",
            "correct": false,
            "goto": "scene_1_wrong"
          },
          {
            "label": "Grab the letter",
            "correct": true,
            "goto": "scene_2"
          }
        ]
      }
    },
    "scene_2": {
      "location": "privet_drive",
      "cast": {
        "harry": "auto_1",
        "vernon": "auto_2",
        "dudley": "auto_3",
        "petunia": "auto_4"
      },
      "beats": [
        {
          "camera": "medium",
          "on": "harry",
          "ms": 700
        },
        {
          "anim": "harry",
          "clip": "reach",
          "async": true
        },
        {
          "anim": "harry",
          "clip": "reach",
          "async": true
        },
        {
          "narrate": "Harry grabbed the letter and held it behind his back."
        },
        {
          "camera": "medium",
          "on": "vernon",
          "ms": 700
        },
        {
          "anim": "vernon",
          "clip": "reach",
          "async": true
        },
        {
          "narrate": "Uncle Vernon lunged across the kitchen and snatched it out of his hand."
        },
        {
          "narrate": "Harry stood in the kitchen doorway, shaking with anger."
        }
      ],
      "ending": {
        "kind": "victory",
        "title": "The Letters",
        "text": "You followed Harry through “The Letters” the way the book tells it."
      }
    }
  }
}
